title,date,text,page_url
Libye : Haftar cède à la Russie une base aérienne près de la frontière avec le Tchad et le Soudan,27/01/2025," - Indésirable en Syrie depuis la chute du président Bachar al-Assad, Moscou jette son dévolu sur un autre pays méditerranéen pour occuper le flanc sud de l’OTAN et assurer la logistique de ses opérations en Afrique. Le maréchal Khalifa Haftar, chef d'une des deux factions qui s’affrontent pour le pouvoir en Libye, a offert à la Russie une base aérienne désaffectée située dans l’extrême sud du pays, près de la frontière avec le Tchad et le Soudan, pour qu’elle en fasse un hub logistique pour les opérations militaires en Afrique. L’information a été rapportée par l’agence de presse italienne Agenzia Nova, qui cite des sources libyennes bien informées. Moscou a déjà envoyé de grandes quantités d'équipements militaires ainsi qu’une force d'officiers et de soldats syriens, qui ont fui leur pays après la chute du régime de Bachar al-Assad, sur cette base baptisée Maaten al-Sarra, a-t-on ajouté de même source. Epaulés par des techniciens russes, ces militaires syriens ont commencé à remettre la base aérienne en service, en restaurant les infrastructures telles que les pistes d'atterrissage et les entrepôts. Cependant, la base a encore besoin de nouvelles installations, notamment des logements, des entrepôts, des tours de contrôle et des clôtures de sécurité. Selon les sources d’Agenzia Nova, un important convoi militaire d’une brigade des forces terrestres de l’armée nationale libyenne (ANL) dirigées par Saddam Haftar, fils de l’homme fort de l’Est libyen, s'est récemment rendu à Maaten al-Sarra pour sécuriser la zone et protéger les routes nécessaires à l'approvisionnement de la base en armes et en carburant depuis le port de Tobrouk, dans le nord-est de la Libye. A terme, la base aérienne est appelée à devenir un centre logistique clé pour les opérations militaires russes en Afrique, en particulier au Soudan, au Mali, au Burkina Faso et au Niger, où la Russie a consolidé sa présence militaire ces derniers mois. La base aérienne de Maaten al-Sarra a été utilisée en 1987 par l’armée de l’air libyenne pour attaquer les positions de l’armée tchadienne dans le cadre de « la guerre des Toyota ». Une violente riposte de l’armée tchadienne avait alors détruit une partie de la base, dont l’aérodrome était doté de trois pistes modernes et d'un grand espace de parking pouvant accueillir plus de 100 avions de combat. Des capacités dans quatre petites bases aériennes Minée par les divisions depuis la chute du régime de Mouammar Kadhafi en 2011, la Libye est gouvernée par deux exécutifs. Dirigé par Abdulhamid al-Dbeibah, le premier exécutif est installé à Tripoli (Ouest) et reconnu par la communauté internationale. Le second, qui siège à Benghazi (Est), est soutenu par le chef de guerre Khalifa Haftar qui contrôle de larges pans du territoire libyen et bénéficie du soutien de plusieurs puissances étrangères, dont la Russie et les Emirats arabes unis. La Russie et ses supplétifs d’Africa Corps (ex-Wagner) ont renforcé ces derniers mois leur présence en Libye avec le transfert de près de 2000 combattants vers ce pays d’Afrique du Nord au printemps 2024, selon le collectif All Eyes on Wagner, un groupe de recherche composé notamment d’universitaires et d’experts en cybersécurité. Moscou dispose également de capacités opérationnelles dans quatre petites bases aériennes libyennes (Al-Khadim, Al-Jufra, Ghardabiya et Brak Al-Shati), qui abritent notamment des systèmes antiaériens, des chasseurs MiG-29 et des drones. Citant des responsables américains et des images satellitaires, la chaîne de télévision CNN avait rapporté, à la mi-décembre 2024, que la Russie a commencé à déplacer des équipements militaires de la Syrie vers l’est de la Libye. « Les Russes ont commencé à déplacer des moyens navals de la Syrie vers la Libye », ont déclaré deux responsables américains à CNN. Un autre responsable du département de la Défense a confié à la chaîne d’information américaine que Moscou avait « accru la pression sur le commandant de l’Armée nationale libyenne, Khalifa Haftar, pour obtenir l’accès à un port à Benghazi ». En 2015, une intervention militaire de la Russie en Syrie avait permis au président syrien Bachar al-Assad de se maintenir au pouvoir face à la progression des factions rebelles dans le nord et le nord-ouest, et aux incursions du groupe Etat Islamique au centre et à l'est. En contrepartie de ce soutien, Damas a offert à Moscou la base aérienne de Hmeimim et la base navale de Tartous situées dans le nord-ouest du pays, sur la côte méditerranéenne. Ces bases sont devenues au fil du temps un véritable hub pour les opérations russes en Afrique. Les troupes russes ont été cependant obligées de quitter la Syrie; à la suite du récent effondrement du régime Assad, dans la foulée d’une offensive éclair menée par une coalition rebelle dominée par Hayat Tahrir Al-Cham (HTC, Organisation de libération du Levant). Walid Kéfi Lire aussi: 18/12/2024 - La Russie transporte du matériel militaire de la Syrie vers la Libye 03/08/2020 - Libye : le GNA accuse la Russie d'avoir acheminé récemment des « mercenaires » et du matériel au maréchal Haftar 11/12/2024 - La chute du régime Assad contrarie les ambitions de la Russie en Afrique 24/05/2024 - La Maison de la Fatwa de Libye appelle au djihad contre les troupes russes d'Africa Corps 15/03/2024 - Selon un think tank, la Russie reste le principal responsable des campagnes de désinformations en Afrique (rapport) 08/03/2024 - Africa Corps, nouveau bras armé de la Russie en Afrique, installe une base militaire au Burkina Faso",https://www.agenceecofin.com/actualites/2701-125249-libye-haftar-cede-a-la-russie-une-base-aerienne-pres-de-la-frontiere-avec-le-tchad-et-le-soudan
"RDC : Goma sous tension, l’ONU réclame le retrait des forces armées étrangères",27/01/2025," - Depuis le dimanche 26 janvier, les combats ont repris autour de Goma, capitale provinciale du Nord-Kivu, assiégée par les rebelles du M23. Une situation qui mobilise de plus en plus l’attention de la communauté internationale qui appelle à la cessation des hostilités. Goma, dans l'est de la République démocratique du Congo (RDC), est au cœur d’une crise sécuritaire et humanitaire alarmante. Depuis plusieurs jours, des affrontements violents opposent les forces armées congolaises (FARDC) au groupe armé M23, près de Kibati, au nord de la ville. Selon plusieurs sources, ce groupe bénéficierait du soutien du Rwanda, une accusation que Kigali rejette. Ces combats ont provoqué d’importants déplacements de populations, exacerbant une situation déjà critique. Avec un million d’habitants, Goma accueille désormais un nombre similaire de déplacés, selon l’Agence France-Presse (AFP). Ces nouveaux arrivants, fuyant les combats, ont quitté des camps proches des zones de conflit pour se réfugier dans le centre-ville. La ville est paralysée : commerces fermés, pénuries d’eau et d’électricité, et accès limité aux produits de première nécessité. Kinshasa accuse ouvertement le Rwanda d’avoir envoyé des troupes en RDC, qualifiant cette action de « déclaration de guerre ». Lors d’une intervention au Conseil de sécurité de l’ONU, la ministre congolaise des Affaires étrangères, Thérèse Kayikwamba Wagner, a réclamé des sanctions contre le Rwanda ainsi qu’un embargo sur ses exportations de minerais. #DRCongo ??: apocalyptic scenes in #Goma as hundreds of thousands of people are forced to flee, desperate to escape from the advancing #M23 and Rwandan forces.Many of the people have been on the run for over 30 years at this point. pic.twitter.com/rYX1jhGXjZ Antonio Guterres, secrétaire général de l’ONU, a fermement condamné la reprise des hostilités dans l’est congolais. Dans un communiqué, il a dénoncé les offensives du M23 et leur extension au Nord-Kivu et au Sud-Kivu exhortant « les parties à rester engagées dans le processus de Luanda et à maintenir l’élan vers la neutralisation des FDLR et le retrait des forces rwandaises », précise l’ONU. Les États-Unis ont également condamné les actions du Rwanda et du M23, exigeant un cessez-le-feu immédiat. L’est de la RDC, riche en ressources minières, est en proie à une insécurité chronique depuis des décennies. L’état de siège déclaré dans les provinces du Nord-Kivu et de l’Ituri, avec une administration militarisée, n’a pas permis de mettre fin aux violences. Sur le plan diplomatique, les efforts de médiation, notamment par l’Angola, n’ont pas encore abouti à un dialogue entre Kinshasa et Kigali. Selon les dernières informations, trois Casques bleus, sept soldats sud-africains et trois malawites engagés dans la force régionale de la SADC (Communauté de développement de l'Afrique australe) auraient été tués dans les combats autour de Goma. L’armée congolaise a également fini par confirmer, le vendredi 24 janvier, la mort du gouverneur militaire du Nord-Kivu, Peter Cirimwami, « tombé au champ d’honneur ».",https://www.agenceecofin.com/actualites/2701-125248-rdc-goma-sous-tension-l-onu-reclame-le-retrait-des-forces-armees-etrangeres
"Tubes africains : Il était une fois Soul Makossa, par Manu Dibango",27/01/2025," - En 1972, Manu Dibango sort « Soul Makossa ». Moquée au début, la chanson initialement dédiée à être un morceau de complément finit pourtant par devenir la plus importante de sa carrière, et l’un des plus grands titres de l’histoire musicale africaine. « Mamase Mamasa Mamakossa » ! Ce gimmick légendaire, signature de Soul Makossa de Manu Dibango, aurait très bien pu ne jamais être connu, tant la trajectoire de la chanson est inattendue. Pour comprendre à quel point son succès est imprévu, il faut se remettre dans le contexte de l’enregistrement.  En 1972, le Cameroun prépare la 8e édition de la Coupe d’Afrique des Nations. Les autorités locales cherchent un hymne officiel, et le ministre des Sports émet carrément un appel d’offres, auquel répond Dibango. Une fois l’accord signé, l’artiste compose « un vrai hymne comme il faut (…) sur lequel les militaires pouvaient jouer » révèle-t-il dans une interview. Sur le vinyle 45 tours prévu pour la chanson, il enregistre donc l’hymne « Mouvement Ewondo » en Face A. En Face B, puisqu’il ne faut pas la laisser vide, il enregistre un curieux titre nommé « Soul Makossa ». Dès les premiers jours où il la répète chez lui, les enfants du voisinage partent en fou rire. Même les parents du saxophoniste se moquent. « Le Président a donné 1 million à ton fils pour aller faire du bruit » déclare son père à sa mère. Pour Manu pourtant, la chanson n’a rien de comique. Pour la concevoir, il s’est inspiré d'un rythme traditionnel, le Makossa, et y a ajouté une touche de soul. Les paroles sont simples, et il crée un gimmick en décomposant le mot makossa et en répétant certaines syllabes. Les voisins s’esclaffent en se demandant pourquoi Manu bégaie. « Tu ne peux pas prononcer ""makossa"" comme tout le monde ? Tu bégayes : ""mamako mamasa"". Tu crois qu'ils vont accepter ça à Yaoundé ? ». Son père n’arrête pas de se moquer, et la suite des événements lui donne de fait raison. Au ministère des sports, « Soul Makossa » ne plait pas. « Mouvement Ewondo » est par contre largement apprécié, même si après une défaite du Cameroun, les supporters détruisent les vinyles gratuitement distribués.  Loin de se décourager, Dibango reprend Soul Makossa sur un album enregistré à Paris. La chanson est découverte par David Mancuso, un DJ new-yorkais qui organise chaque week-end des fêtes underground dans son loft, et est aussi influent que connu pour sa capacité à faire découvrir des titres à fort potentiel. Il trouve un vinyle avec Soul Makossa dans une boutique de Brooklyn, et très vite, il recommande la chanson à plusieurs connaissances dont le DJ Frankie Crocker, animateur de WBLS, la radio noire la plus populaire du moment. Soul Makossa y est alors régulièrement diffusé. Le titre devient alors un incontournable de la radio et des clubs américains. En mai 1973, Ahmet Ertegun qui dirige le label Atlantic, propriétaire du catalogue du légendaire groupe de rock Led Zeppelin, réussit à signer le titre. Quelques semaines plus tard, ce dernier occupe la 35e place du Billboard Hot 100, le classement hebdomadaire des 100 chansons les plus populaires aux USA. La suite relève de l’incroyable. Il devient l’une des chansons les plus populaires de l’industrie musicale, à tel point qu’une décennie plus tard en 1982, le fameux gimmick alors moqué à Yaoundé est repris de manière illégale par Michael Jackson lui-même dans sa chanson « Wanna Be Starting Something », la 1re de Thriller qui n’est autre que l’album le plus vendu de l’histoire.  Cela déclenchera une longue procédure judiciaire opposant Manu Dibango au roi de la pop, ce dernier finissant par le créditer sur la chanson. Mais ça, c’est une histoire pour un autre jour… Soul Makossa est aujourd’hui considérée comme la chanson africaine la plus samplée de tous les temps et l’un des titres les plus marquants de l’histoire de la musique.  Servan Ahougnon Edité par : Feriol Bewa",https://www.agenceecofin.com/actualites-culture/2701-125247-tubes-africains-il-etait-une-fois-soul-makossa-par-manu-dibango
"Au Bénin, l’ambition d’une économie cashless pour doper les recettes fiscales",27/01/2025," - Réduire le cash et digitaliser les paiements pour mieux recouvrer les recettes fiscales, c’est l’un des objectifs du gouvernement. Mais dans un pays où les préférences culturelles, le manque d’infrastructures et les coûts associés aux transactions électroniques freinent l’adoption, le succès reste loin d’être garanti. Depuis le 1er janvier 2025, les transactions en espèces supérieures à 100 000 FCFA (environ 159 $) sont taxées à hauteur de 1 %. Au Bénin, la mesure a fait polémique, mais est révélatrice des ambitions du gouvernement de Patrice Talon, bien décidé à digitaliser l’économie béninoise et à réduire la part encore écrasante du liquide dans les échanges commerciaux. Derrière cette mesure se cache un double objectif : renforcer la traçabilité des flux financiers et augmenter les recettes fiscales. Mais dans un pays où 75 % de la population n’a pas accès aux services bancaires, avec des infrastructures financières limitées et où l’économie informelle représente près de la moitié du PIB, le pari est audacieux. Antoinette, prise au piège du cash Ce jeudi-là, Antoinette, quadragénaire de Cotonou, ne décolère pas. Venue déposer 900 000 FCFA en espèces dans une étude notariale pour finaliser des formalités d’obtention de titres fonciers, elle découvre qu’elle doit s’acquitter d’une taxe de 9 000 FCFA sur la somme déposée. « Pourquoi devrais-je payer pour utiliser mon propre argent ? », s’indigne-t-elle, visiblement frustrée. Pourtant, elle avait retiré cet argent en liquide directement de son compte bancaire pour éviter les complications habituelles : chèques souvent refusés dans les administrations, délais parfois interminables des virements, et réticences des entreprises à accepter les paiements via mobile money. « Avec les mobiles, c’est compliqué. Certaines entreprises les refusent carrément, explique-t-elle. Résultat : elle a préféré le cash, mais s’est retrouvée piégée par une mesure fiscale qu’elle avait oubliée. Au marché Dantokpa, le cash encore omniprésent À Cotonou, dans les allées bondées du marché Dantokpa, le plus grand du pays, les liasses de billets continuent de circuler. Ici, les vendeurs de tissus, légumes ou appareils électroniques encaissent encore du “liquide”. « Pourquoi devrais-je payer une taxe pour utiliser mon argent ? », s’insurge Françoise, une vendeuse de tissus. Cette nouvelle taxe sur les paiements en espèces, bien qu’épargnant les dépôts bancaires, transferts via mobile money ou retraits, commence à peser sur les transactions importantes, surtout pour les clients qui exigent une facture. Dans ce marché où le numérique reste rare, les commerçants craignent que la réforme n’accentue leurs difficultés. « Ici, on n’a pas de terminaux de paiement, et tout le monde préfère le cash. Cette taxe va juste pousser les commerçants à augmenter leurs prix », estime un vendeur de téléphones. Malgré les efforts pour digitaliser l’économie, l’idée d’un avenir cashless semble encore bien lointaine pour nombre d’acteurs du secteur informel.  Les réformes en place pour moderniser les paiements La taxe s’inscrit dans une série de réformes engagées depuis plusieurs années pour encourager la digitalisation et accroître les recettes fiscales. Depuis 2021, les entreprises assujetties à la TVA doivent s’équiper de Machines électroniques certifiées de facturation (MECEF). Ces dispositifs enregistrent les transactions en temps réel et transmettent les données directement à la Direction générale des Impôts (DGI). Au 31 décembre 2023, 157 039 machines MECEF avaient été déployées, pour 11 073 contribuables, selon la Banque mondiale. Toutefois, leur adoption reste limitée dans le secteur informel, qui constitue une part majeure de l’économie. Une adoption croissante des paiements numériques Pourtant les paiements électroniques ont fortement progressé dans le pays depuis la crise causée par la pandémie de Covid-19, à mesure que l'administration et l’économie se digitalisent. Selon les données de la BCEAO, entre 2020 et 2023, les transactions numériques ont augmenté de 68 %, passant de 28 millions d'opérations à 47,2 millions. En valeur, elles représentent désormais 2 115 milliards FCFA, soit presque le double des 1 200 milliards FCFA enregistrés en 2020. Des services comme MTN Mobile Money et Moov Money jouent un rôle central, en particulier pour les populations non bancarisées. Selon l'Autorité de régulation des Communications électroniques et de la Poste (ARCEP), le nombre de comptes de services financiers mobiles est passé de 2,6 millions en 2018 à 11,1 millions en 2023, soit une augmentation de 327 % sur cinq ans, mais l’adoption reste entravée par des frais souvent jugés prohibitifs et une utilisation encore limitée dans le commerce. Les cas d’usage sont également limités, malgré une expansion récente, notamment pour le paiement des factures. Mais on est encore loin de ce que le M-Pesa peut représenter au Kenya. D’un autre côté, le nombre de cartes bancaires en circulation a également augmenté. On en dénombrait 1,33 million en 2023, contre 800 000 en 2020. Toutefois, là encore, leur utilisation se heurte à des infrastructures limitées : avec seulement 326 guichets automatiques bancaires (GAB) et 498 terminaux de paiement électronique (TPE), ces services restent concentrés dans les zones urbaines, laissant de nombreuses régions rurales sans accès aux outils nécessaires.  Un attachement tenace au cash Malgré les avancées, le cash conserve une place dominante dans l’économie béninoise. « Avec le liquide, pas de frais supplémentaires, pas de pannes, c’est rapide et fiable », confie un commerçant du marché Dantokpa. Les frais élevés des transactions numériques freinent l’adoption de ces outils, en particulier pour les petits commerçants dont les marges sont déjà serrées. « Les frais pour les cartes bancaires ou le mobile money, c’est parfois notre marge. Personne ne veut payer pour ça », déplore un vendeur. Dans les zones rurales, où les infrastructures financières et numériques sont quasi inexistantes, le cash est souvent la seule option. Fiacre E. Kakpo",https://www.agenceecofin.com/actualites/2701-125246-au-benin-l-ambition-d-une-economie-cashless-pour-doper-les-recettes-fiscales
RDC : la mine d’étain de Bisie a produit 17 324 tonnes pour Alphamin Resources en 2024 (+38%),26/01/2025," - Principal exploitant industriel d’étain en RDC, Alphamin a mis en service en mai 2024 une nouvelle usine de traitement à Bisie, qui a largement contribué à cette hausse de production. Il vise désormais les 20 000 tonnes en 2025. La société minière basée à Maurice Alphamin Resources a annoncé une production d’étain de 17 324 tonnes pour sa mine de Bisie dans le Nord-Kivu en RD Congo. C’est, précise-t-elle, 38% de plus qu’en 2023, conformément à ses prévisions (entre 17 000 et 18 000 t). Ses revenus ont aussi progressé, avec la tonne à 30 345 $ en moyenne en 2024 contre 26 009 $ en 2023 informe Bankable. Le bénéfice avant intérêts, impôts, dépréciation et amortissement (EBITDA) a ainsi plus que doublé, atteignant 274,1 millions $ en 2024, contre 135,5 millions $ l’année précédente. Des critiques émergent néanmoins à propos de son impact sur les communautés locales. Une enquête menée par l’organisation à but non lucratif Mongabay a mis en lumière les plaintes des communautés autochtones de Banamwesi et Motondo, qui accusent Alphamin d’avoir accaparé leurs terres sans consultation préalable. Quant aux retombées pour le Congo, le gouvernement détient une participation de 5% dans la mine et perçoit une redevance minière équivalant à 3,5% des revenus de vente de l’étain. L’entreprise est également soumise à un impôt sur les sociétés de 30%, conformément à la législation fiscale en vigueur dans le pays.",https://www.agenceecofin.com/actualites-industries/2601-125245-rdc-la-mine-d-etain-de-bisie-a-produit-17-324-tonnes-pour-alphamin-resources-en-2024-38
