title,date,text,page_url
Copper 360 va acquérir le projet éolien Mulilo Springbok Wind Power en Afrique du Sud,24/01/2025," - Le secteur minier africain est confronté à la volatilité des prix de l'énergie et à la pollution de l'environnement due aux émissions massives de carbone. Dans ce contexte, les compagnies en Afrique du Sud misent davantage sur le renouvelable, pour réduire émissions et coûts. La compagnie minière sud-africaine Copper 360 spécialisée dans l’extraction de cuivre, a annoncé le jeudi 23 janvier avoir conclu un accord pour acquérir Mulilo Springbok Wind Power (MSWP), un projet éolien de 55 MW situé dans la région de Springbok, Northern Cape. L’acquisition du projet, dont les études de faisabilité ont déjà été faites et qui dispose des autorisations environnementales nécessaires, sera finalisée en février 2025. La transaction comprend un paiement initial de 5 millions de rands (environ 272 000 USD), et des paiements différés de 1 million de rands par MW de capacité installée. Ce projet permettra à Copper 360 d’alimenter ses opérations minières en énergie renouvelable, tout en réduisant ses coûts et son empreinte carbone. La direction explore également une stratégie pour intégrer davantage d’énergies renouvelables dans son modèle économique. L’intégration des énergies renouvelables dans le secteur minier présente des avantages économiques et environnementaux significatifs. Les coûts d’exploitation des systèmes énergétiques renouvelables (SER) sont de plus en plus compétitifs par rapport à ceux aux combustibles fossiles, notamment pour les mines hors réseau qui dépendent de générateurs diesel coûteux. Les micro-réseaux par exemple, permettent une intégration efficace de différentes sources d’énergie renouvelable et offrent une flexibilité adaptée aux besoins des mines. Avec l’acquisition du projet MSWP, Copper 360 s’aligne sur une tendance locale et mondiale visant à rendre le secteur minier plus durable. Cette acquisition pourrait servir de modèle pour d’autres acteurs industriels, tout en contribuant aux objectifs climatiques et économiques de l’Afrique du Sud. Abdoullah Diop Edité par : Feriol Bewa",https://www.agenceecofin.com/actualites/2401-125207-copper-360-va-acquerir-le-projet-eolien-mulilo-springbok-wind-power-en-afrique-du-sud
Sénégal : recrutement de 2000 enseignants pour réduire le déficit,24/01/2025," - En septembre, le gouvernement estimait son besoin d’enseignants à 4527 pour l’année scolaire 2024-2025. Pour résorber ce déficit, une feuille de route triennale pour le recrutement d’enseignants a été présentée. Le ministère sénégalais de l’Éducation nationale a publié, le jeudi 23 janvier, un appel à candidatures en vue du recrutement de 2000 enseignants pour l’année scolaire 2024-2025. D’après l’institution gouvernementale, l’un des objectifs de ce recrutement est de « répondre au déficit en personnel enseignant dans les zones urbaines et rurales ». En septembre dernier, le Premier ministre, Ousmane Sonko, lors de la réunion interministérielle en vue de préparer la rentrée scolaire, a estimé le besoin pour cette année scolaire à 4527 enseignants. L’enrôlement de 2000 nouveaux enseignants ne suffira donc qu’à couvrir la moitié du besoin estimé pour cette période. Ce recrutement s’inscrit dans la dynamique d’un programme triennal de recrutement d’enseignants présenté par le gouvernement en décembre 2024. À en croire le communiqué du Conseil des ministres tenu ce mois-là, l’exécutif sénégalais va mettre en œuvre un programme de 3 ans (2025, 2026 et 2027) pour résorber le déficit d’enseignants dans les écoles publiques, collèges et lycées du pays. En plus de résorber le déficit d’enseignants, ce programme de recrutement aura également le mérite de garantir une meilleure équité dans la répartition des enseignants, ainsi que de renforcer l’efficacité du système éducatif sénégalais pour améliorer les performances des élèves. Notons que l’appel à candidatures en cours jusqu’au 1er février s’adresse aux personnes de nationalité sénégalaise âgées de 18 à 35 ans. Les candidats doivent être titulaires du baccalauréat ou d’un diplôme professionnel d’enseignement pour les niveaux élémentaire et préscolaire, être titulaires d’une licence ou d’un diplôme d’enseignement pour les niveaux moyen et secondaire. Les candidats doivent être prêts à servir partout sur le territoire national. Plus d’informations ici. Vanessa Ngono Atangana Edité par Sèna D. B. de Sodji Lire aussi: Le Sénégal prépare un plan triennal pour résorber le déficit d’enseignants",https://www.agenceecofin.com/actualites/2401-125206-senegal-recrutement-de-2000-enseignants-pour-reduire-le-deficit
Les levées de fonds des start-up africaines ont reculé de 7% en 2024 (Partech Africa),24/01/2025," - Les financements en dette ont connu une baisse à deux chiffres durant l’année écoulée, en raison notamment de la hausse des taux d'intérêt et de l'appréciation du billet vert par rapport aux monnaies africaines. Ce mode de financement non dilutif représente tout de même près du tiers du total des levées de fonds. Les start-up africaines ont levé 3,2 milliards de dollars en equity et en dette en 2024, un montant en baisse de 7% par rapport à 2023, selon un rapport publié le jeudi 23 janvier par le fonds de capital-risque Partech Africa. Intitulé « Africa Tech Venture Capital 2024 », le rapport précise que les montants levés en equity restent stables à 2,2 milliards de dollars par rapport à l’année 2023 tandis que la valeur des financements en dette a chuté de 17%, à 1 milliard de dollars.  La baisse de la valeur des financements en dette s’explique essentiellement par la hausse des taux d'intérêt et l'appréciation du dollar américain par rapport aux monnaies africaines. En effet, la pression sur les monnaies locales a entraîné une augmentation du coût des emprunts libellés en billet vert et des charges de remboursement pour les start-up africaines. Malgré cette baisse de régime enregistrée en 2024, la dette représente encore 31% du total des financements mobilisés par les start-up actives sur le continent. Le rapport indique également que l’activité dans l’écosystème tech africain est restée relativement stable, avec 457 transactions en equity (-3%) et 77 transactions en dette (+4%). En ce qui concerne la taille moyenne des tickets, une baisse a été constatée dans la plupart des phases d'investissement, en particulier dans la série A (-18%) et la série B (-27%). La phase Seed s'est mieux portée, avec une augmentation de 26% de la taille moyenne des tickets. Les montants totaux des financements ont diminué à tous les stades de développement des jeunes pousses, à l'exception de la phase de croissance (Growth). Les mégadeals (transactions dont le montant est supérieur à 100 millions de dollars) ont augmenté à la fois en nombre (+43% par rapport à l'année 2023) et en valeur (+57%). Trois mégadeals de dette et 4 mégadeals en equity ont été recensés en 2024, pour une valeur totale de 1,1 milliard de dollars.  La fintech capte l’essentiel des financements en equity La répartition par pays du total des levées de fonds en equity réalisées par l’ensemble des jeunes pousses africaines durant l’année écoulée montre que le Nigeria occupe la première marche du podium avec 520 millions de dollars, devant l’Afrique du Sud (459 millions), l’Egypte (297 millions) et le Kenya (221 millions). Ces quatre pays connus sous l’appellation des « Big four » ont ainsi continué à dominer les levées de fonds en equity sur le continent, mais dans une moindre mesure que les années précédentes (67% du total en 2024 contre 79% en 2023 et 72% en 2022). En dehors des quatre premiers pays, le Ghana, le Maroc et la Tanzanie sont les seuls autres pays à avoir dépassé le seuil de 50 millions de dollars levés en equity en 2024.  La ventilation sectorielle des levées de fonds en equity fait, quant à elle, ressortir que le secteur de la fintech a continué à dominer l'écosystème technologique africain, en récoltant 1,3 milliard de dollars, soit 60% du total des financements. Viennent ensuite les secteurs de la cleantech (9%), du commerce électronique (7%), des services aux entreprises (7%) et de l’agritech (4%).  En ce qui concerne les financements en dette, le Kenya tient le haut du pavé avec 382 millions de dollars, devant l’Egypte (142 millions), l’Afrique du Sud (132 millions) et le Ghana (118 millions). A l’instar des années précédentes, la cleantech a capté la plus grosse part des prêts accordés aux start-up africaines (40%) devant la fintech (34%) et les jeunes pousses spécialisées dans le domaine de la connectivité (11%). Le rapport révèle par ailleurs que le nombre des investisseurs uniques en equity a augmenté de 2% par rapport à 2023 pour atteindre 583. Ces investisseurs ont été plus actifs dans la phase seed, et moins impliqués dans la série A et la série B comparativement aux années précédentes. Walid Kéfi Edité par M.F. Vahid Codjia Lire aussi: 18/11/2024 - En Afrique, le capital-risque est de plus en plus friand de la fintech, de l’IA et de la climate Tech (rapport) 08/01/2025 - Les start-up africaines ont levé 2,2 milliards $ en 2024, en recul de 25% 17/12/2024 - Start-up africaines : 86% des fondateurs ont des problèmes de bien-être mental (rapport) 19/02/2024 - Le deuxième fonds africain de Partech Partners clos à plus de 301 millions $ cible une vingtaine de start-up 23/01/2024 - En 2023, 50 % des investisseurs actifs dans des start-up africaines se sont retirés du continent (Partech Africa 2023)",https://www.agenceecofin.com/ecofin-pro/2401-125205-les-levees-de-fonds-des-start-up-africaines-ont-recule-de-7-en-2024-partech-africa
Le projet Mozambique LNG de TotalEnergies risque un nouveau report,24/01/2025," - En 2023, TotalEnergies a diligenté un rapport afin d’évaluer la situation sécuritaire de Cabo Delgado au Mozambique, où son projet gazier est à l’arrêt depuis bientôt 4 ans, en raison d’une insurrection djihadiste dans la région. La reprise du projet gazier Mozambique LNG opéré par la major pétrolière française TotalEnergies n’est pas pour tout de suite. C’est ce que suggère une information relayée mercredi 22 janvier par la multinationale évoquant la persistance de la menace sécuritaire à Cabo Delgado, localité qui héberge le projet. À en croire la compagnie, l’aggravation ces derniers mois des défis de sécurité dans cette région l’ont contraint à réévaluer son calendrier concernant ce projet dont l’entrée en production était prévue pour 2029. TotalEnergies n’a pas fourni de nouvelle date de reprise des activités de développement qui pourrait intervenir après 2029. Ces dernières sont en effet interrompues depuis 2021, dans la foulée de la déclaration d’un état de force majeure sur Mozambique LNG. En 2023, une étude réalisée pour le compte de la multinationale française a conclu à l’amélioration de la situation humanitaire et sécuritaire à Cabo Delgado. Un développement qui avait suscité l’espoir d’une reprise du projet. Cependant les troubles post-électoraux qui ont suivi les élections présidentielles contestées d’octobre 2024 ont créé un contexte d’instabilité politique qui compromet quelque peu les perspectives de relance du projet à court terme. Pour TotalEnergies, l’avenir de ce projet gazier, budgétisé à 20 milliards de dollars, dépend en priorité des efforts des parties prenantes pour « rétablir la paix et la sécurité dans le Cabo Delgado et lever la force majeure ». Pour rappel, un contingent d’environ 4500 soldats de l’armée rwandaise a été déployé dans la région à cet effet. Une rencontre attendue entre le patron de TotalEnergies, Patrick Pouyanné, et le président élu du Mozambique Daniel Chapo, pourrait également soutenir les initiatives dans ce sens. Le projet Mozambique LNG qui vise à produire jusqu’à 43 millions de tonnes de GNL par an est essentiel pour contribuer à la croissance de l’économie du Mozambique. « Le PIB réel [du Mozambique, Ndlr] devrait croître en moyenne de 5,2 % entre 2024 et 2025, sous l’impulsion du secteur extractif, en particulier de la production de gaz », indiquent des prévisions de la Banque africaine de développement (BAD). Abdel-Latif Boureima Édité par Wilfried ASSOGBA Lire aussi : 29/05/2024 - Mozambique: 2000 soldats rwandais de plus pour contrer l'insurrection djihadiste 24/05/2023 - Mozambique : le calme revient dans la province du Cabo Delgado pour le projet gazier de TotalEnergies à 20 milliards $ (rapport)",https://www.agenceecofin.com/actualites-industries/2401-125204-le-projet-mozambique-lng-de-totalenergies-risque-un-nouveau-report
MTN Nigeria renouvelle ses licences 4G,24/01/2025," - Malgré le déploiement de la 5G, MTN continue d’investir dans les technologies antérieures. En mai 2023, l’entreprise avait déjà investi 58,7 milliards de nairas (37,7 millions $) pour renouveler sa licence 3G jusqu’en 2037. La société télécoms MTN Nigeria a annoncé, le mardi 21 janvier, le renouvellement de sa première licence de spectre dans la bande de 800 MHz pour une période additionnelle de dix ans, jusqu'au 31 décembre 2034. L’opérateur a également obtenu une extension de quatre ans de sa deuxième licence 800 MHz qui devait expirer le 31 décembre 2030. La société télécoms se donne ainsi les moyens de poursuivre l’extension de son réseau 4G à travers le pays. « Nous sommes ravis du renouvellement réussi et de l'harmonisation de nos licences de spectre 800MHz, qui posent une base solide pour la fourniture continue des services 4G à nos clients. Cela nous permet de continuer à répondre à la demande croissante en données et constitue un élément clé de notre stratégie plus large visant à améliorer la connectivité », a déclaré Karl Toriola, DG de MTN Nigeria, dans un communiqué publié sur le Nigerian Stock Exchange (NSE). L’initiative intervient dans un contexte où MTN veut accélérer l’extension de son réseau au Nigeria. La société revendique sur son site web une couverture générale de 92 % de la population. En ce qui concerne la 4G, l’entreprise revendiquait déjà une couverture 4G de 81,5 % de la population fin 2023. Lors de la conférence téléphonique de présentation des résultats du troisième trimestre 2024, M. Toriola a déclaré qu’environ 20 % des sites de l’opérateur télécoms ne sont pas encore compatibles avec la 4G. L’extension de la 4G pourrait également permettre à MTN Nigeria de toucher de nouveaux clients et de renforcer sa position sur le marché télécoms national. Selon les données de la Nigerian Communications Commission (NCC), la filiale locale du groupe sud-africain MTN détenait 80,3 millions d’abonnés à la téléphonie mobile pour une part de marché de 51,09 % au 31 octobre 2024. L’entreprise est en concurrence avec Airtel, Globacom et 9mobile qui contrôlaient respectivement 34,61 %, 12,15 % et 2,15 % du parc national d’abonnés à la téléphonie mobile. Cependant, il est important de rappeler que le renouvellement des licences de spectre ne garantit pas systématiquement l’extension du réseau. L’entreprise devra investir conséquemment dans son infrastructure physique. Au cours de la conférence téléphonique avec les investisseurs, ces derniers ont notamment pointé du doigt la baisse des dépenses d’investissements (CAPEX) et le ralentissement de la 4G entraînant une baisse des revenus de la data. M. Toriola a déclaré que cela était notamment dû à un certain nombre de facteurs liés à l’environnement opérationnel. Isaac K. Kassouwi Edité par Sèna D. B. de Sodji",https://www.agenceecofin.com/actualites-numerique/2401-125203-mtn-nigeria-renouvelle-ses-licences-4g
La plus grande raffinerie du Soudan au cœur de combats entre l’armée et les FSR,24/01/2025," - Depuis le début de la guerre au Soudan en 2023, les Forces de Soutien Rapide (FSR) ont pris le contrôle de plusieurs infrastructures critiques, parmi lesquelles des installations pétrolières essentielles pour l’État. Le jeudi 23 janvier, la presse locale du Soudan a annoncé des affrontements entre l’armée régulière et les FSR près de la raffinerie d’Al-Jeili, située au nord de Khartoum, la capitale du pays. C’est la plus grande des trois raffineries du pays avec une capacité de 100 000 b/j. L’éventuelle reprise par l’armée de cette installation, actuellement aux mains des FSR, devrait permettre à l’État de mieux répondre à ses besoins en énergies. L’infrastructure constitue en effet la principale source d’approvisionnement en produits pétroliers du Soudan. Ces combats contre les FSR interviennent dans un contexte plus large d’offensives de l’armée ciblant des zones proches de l’installation. Des combats qui ont d’ailleurs permis la reprise des usines Rotana Flour Mills qui fournissent l’essentiel de la farine consommée dans le pays. Bien que des détails précis ne permettent pas de confirmer si l’objectif est de reprendre l’installation aux FSR, certains indices suggèrent cette possibilité. Parmi ces indices, le fait que la raffinerie d’Al-Jeili soit l’une des rares installations pétrolières du Soudan encore en activité. « L’état opérationnel de la raffinerie d’Al-Jeili n’est pas clair », indique une étude de l’U.S. Energy Information Administration (EIA) qui laisse planer un doute sur les capacités opérationnelles effectives de la raffinerie qui a notamment subi des dommages liés aux combats. « Le raffinage du pétrole a été gravement perturbé sur tous les sites de traitement dans ce qui semble être des mouvements militaires stratégiques de l’armée et des FSR pour limiter l’accès de l’autre camp au carburant », indique une étude de Small Arms Survey, un projet de recherche de l’Institut de hautes études internationales et du développement (IHEID) à Genève (Suisse). Et d’ajouter : « le blocage des circuits d’approvisionnement en essence a contraint l’armée à se tourner vers le carburant importé, ce qui a perturbé leur mobilité ». Abdel-Latif Boureima Édité par Wilfried ASSOGBA Lire aussi : 09/10/2023 - Conflit au Soudan : une station de production pétrolière, aux mains des forces paramilitaires de soutien rapide (FSR)",https://www.agenceecofin.com/actualites-infrastructures/2401-125202-la-plus-grande-raffinerie-du-soudan-au-c-ur-de-combats-entre-l-armee-et-les-fsr
"Gabon : Serge Brice Ngodjou, nouvel administrateur directeur général du FGIS",24/01/2025," - Il remplace Persis Lionel Essono Ondo, limogé un mois après sa nomination après des soupçons de fraude sur ses diplômes. Lors du Conseil des ministres du mercredi 22 janvier 2025, Persis Lionel Essono Ondo (photo) a été démis de ses fonctions d’administrateur directeur général (ADG) du Fonds gabonais d’investissements stratégiques (FGIS). Il a été remplacé par Serge Brice Ngodjou qui sera accompagné de Chimène Ayito en qualité de directrice générale adjointe. Persis Lionel Essono Ondo est débarqué moins d’un mois après sa nomination. En effet, il avait été porté à la tête de cette structure lors du Conseil des ministres du 19 décembre 2024 et avait officiellement pris ses fonctions le 26 décembre, en remplacement de Stéphane Mbadinga Ditengou. Peu après, des accusations de falsification de son curriculum vitae ont émergé dans la presse. Selon ces informations, les entreprises mentionnées dans son CV, où il aurait acquis des expériences professionnelles, sont majoritairement inexistantes ou fictives. Il n’avait cependant pas officiellement démenti ces accusations. Persis Lionel Essono Ondo Son limogeage laisse penser que cette controverse liée à son CV a eu raison de lui, d’autant que le gouvernement n’a pas fourni d’explications sur ce changement soudain à la tête du Fonds. Le nouvel ADG, Serge Brice Ngodjou, est diplômé de l’Ecole supérieure de génie informatique (ESGI) et de l’INSEEC Paris. Né le 21 août 1978 au Gabon, il était, avant sa nomination, senior business analyst au sein de Candriam, une société de gestion d'actifs. Il a également occupé la même fonction entre 2017 et 2019 au sein du Crédit Agricole CIB à Paris en France, et entre 2016 et 2017 au sein de Belfius en Belgique. Serge Brice Ngodjou Notons que le FGIS gère un portefeuille d'actifs évalué à 500 millions de dollars. Il est à la tête de neuf filiales, dont la Façade maritime du champ triomphal (FMCT), la Société commerciale gabonaise de réassurance (SCG-Ré), la Société de garantie du Gabon (SGG), et la Société d’électricité, de téléphone et d’eau du Gabon (Seteg). Sandrine Gaingne",https://www.agenceecofin.com/nominations/2401-125201-gabon-serge-brice-ngodjou-nouvel-administrateur-directeur-general-du-fgis
