title,date,text,page_url
Lutte contre le changement climatique : les performances des pays africains en 2025 (Germanwatch),23/01/2025," - L’indice couvre 63 pays plus l’Union européenne. Germanwatch a cependant volontairement laissé les trois premières places vides, étant donné qu’aucun pays ne fournit assez d’efforts pour contenir le réchauffement climatique sous le seuil critique de 1,5°C. Le Maroc est le pays africain le plus performant dans le domaine de la lutte contre le changement climatique, selon le classement « The Climate Change Performance Index 2025 » publié par l’ONG environnementale allemande Germanwatch. Ce classement mesure et compare les efforts déployés par 63 pays du monde plus l’Union européenne dans le domaine de la lutte contre le dérèglement climatique et de l’atténuation de ses effets. Il se base sur 14 indicateurs regroupés dans quatre grands critères : les émissions de gaz à effet de serre (40 % du score global de chaque pays étudié), le déploiement des énergies renouvelables (20 %), l’utilisation de l’énergie (20 %) et la pertinence de la politique climatique (20 %). Réunis, les pays étudiés génèrent plus de 90 % des émissions mondiales de gaz à effet de serre. Comme lors des précédentes éditions de l’indice publié chaque année depuis 2005, les trois premières places de ce classement ont été laissées vides. Ce n’est pas une erreur. Germanwatch a volontairement décidé de ne pas attribuer ces places afin de symboliser l’incapacité des Etats à mettre en place des politiques efficaces pour réduire leurs émissions de CO2 de manière à contenir le réchauffement climatique sous le seuil critique de 1,5°C. « Aucun pays n’a fait assez pour prévenir les changements climatiques dangereux et mériter de se classer dans le Top 3 », souligne l’ONG. Les pays couverts par l’indice sont classés en cinq catégories : très fortes performances, bonnes performances, performances moyennes, faibles performances, très faibles performances. Le Maroc gagne un rang par rapport à l’édition 2024 du classement pour occuper la 8e place cette année, avec un score global de 68,32 points sur une échelle de 100. Le royaume chérifien figure ainsi dans la catégorie des « pays performants » grâce notamment à ses bonnes notes dans les critères émissions de gaz à effet de serre et utilisation de l’énergie. L’Egypte (20e place sur les pays étudiés) gagne deux rangs par rapport à 2024 et se classe ainsi à la deuxième position à l’échelle africaine avec un score de 60,52 points. Le Nigeria occupe la troisième marche du podium en Afrique, avec un score de 59,16 points. Ce pays d’Afrique de l’Ouest, qui figure dans la catégorie affichant une « performance moyenne » dans le domaine de la lutte contre le changement climatique aux côtés de l’Egypte, perd neuf places dans le classement (26e cette année et 17e l’année dernière), en raison notamment des plans du gouvernement visant à augmenter l’utilisation domestique et les exportations de gaz naturel. Centrale thermique à charbon de Matla (Afrique du Sud) L’Afrique du Sud occupe le 4e rang en Afrique et le 38e rang sur l’ensemble des pays étudiés, avec un score de 52,74 points. La nation arc-en-ciel, qui ne parvient pas encore à sortir du charbon, figure dans la catégorie des pays affichant de « faibles performances ». Le cinquième pays africain figurant dans l’édition 2025 du Climate Change Performance Index est l’Algérie. Ce pays d’Afrique du Nord, dont le mix énergétique est dominé par les énergies fossiles, occupe la 51e position sur les pays étudiés avec un score de 45,96 points. A l’échelle mondiale, le Danemark reste le pays le plus performant dans la lutte contre le changement climatique avec un score de 78,37 points, devant les Pays-Bas et le Royaume-Uni. En bas du tableau, on trouve naturellement des pays exportateurs et consommateurs de combustibles fossiles comme les Emirats arabes unis, l'Arabie saoudite et l'Iran. A noter par ailleurs que la plupart des pays du G20 – responsables de 75 % des émissions mondiales – affichent des scores bas ou très bas, à l’exception du Royaume-Uni (6e) et de l’Inde (10e). Walid Kéfi Lire aussi: 06/03/2024 - Lutte contre le changement climatique en Afrique : l’ONU estime le déficit de financement à 2500 milliards $ d’ici 2030 15/11/2024 - Finance climat : engagement accru des BMD, mais la part de l’Afrique ne suffit pas 24/10/2024 - Record des financements climatiques à 52 milliards $ en Afrique en 2022 (rapport) 30/10/2023 - En Afrique francophone, 68 % des PME voient le changement climatique comme une menace majeure (sondage) 07/09/2023 - L'Afrique a besoin de 100 milliards $ par an pour l'adaptation au changement climatique. Qui va payer ? (rapport)",https://www.agenceecofin.com/actualites/2301-125154-lutte-contre-le-changement-climatique-les-performances-des-pays-africains-en-2025-germanwatch
Message aux lecteurs de l’Agence Ecofin,23/01/2025,"(MEDIAMANIA) - L’Agence Ecofin subit depuis plusieurs semaines des cyberattaques massives et régulières qui nous ont amenés à élever notre niveau de sécurité. Il se peut qu’à la suite de ces mesures, une infime proportion de nos lecteurs ne parvienne plus à accéder au site www.agenceecofin.com depuis leur connexion habituelle. Si c’est votre cas, nous vous invitons à communiquer votre adresse IP à itdesk@agenceecofin.com en précisant le message qui s’affiche lorsque vous vous connectez. Pour connaître votre adresse IP, rendez-vous à www.mon-ip.com Vraiment désolés pour ces nuisances. Cordialement ",https://www.agenceecofin.com/reflexion/2301-125153-message-aux-lecteurs-de-l-agence-ecofin
"En 3 ans, le parc de South African Airways est passé de 6 à 20 avions",22/01/2025," - Depuis sa reprise il y a 3 ans, South African Airways a retrouvé des couleurs. La compagnie densifie progressivement son parc d’avions, qui a plus que triplé depuis fin 2021. Le parc de South African Airways (SAA) est désormais à 20 avions, après que le transporteur y a ajouté ces dernières semaines 2 Airbus A320 acquis en leasing. Les appareils sont arrivés à Johannesburg en provenance des hangars d’AerCap en Irlande, le leader mondial de la location d’avions. Repêchée in extremis d’une procédure de liquidation il y a environ 3 ans, la compagnie sud-africaine avait en effet perdu une grande partie de son parc estimé à près d’une cinquantaine d’avions. Relançant ses activités avec 6 aéronefs, elle s’est concentrée sur les vols domestiques et régionaux pour redresser ses finances, déclarant un profit net de 252 millions de rands pour l’exercice 2022-2023 (14 millions USD au cours d’alors), soit son 1er résultat positif depuis 2012. De quoi conforter son programme de restructuration et d’expansion. SAA prévoit de porter son parc à 43 avions sur les 5 prochaines années, dont 5 nouveaux appareils au cours de l’année civile 2025. Cela lui permettra d’agrandir son réseau qui actuellement constitué d’une quinzaine de destinations contre une cinquantaine avant sa cessation d’activités. Le transporteur desservait alors en dehors de l’Afrique, des destinations en Europe, en Amérique, en Asie, en Australie et au Moyen-Orient. Henoc Dossa Edité par : Feriol Bewa",https://www.agenceecofin.com/actualites-services/2201-125152-en-3-ans-le-parc-de-south-african-airways-est-passe-de-6-a-20-avions
Mali : 771 millions $ pour répondre aux besoins humanitaires en 2025 (ONU),22/01/2025," - Le Mali connaît une augmentation des besoins humanitaires en raison de la violence continue, du changement climatique et des défis socio-économiques. En juin 2024, le pays a accueilli près de 120 000 réfugiés, en hausse de 54% par rapport à décembre 2023, selon le HCR. L’ONU et ses partenaires, en collaboration avec le gouvernement du Mali, ont procédé au lancement du plan de réponse et de besoins humanitaires pour l’année 2025 estimé à 771,3 millions $. C’est ce qu’indique un communiqué du Bureau des Nations Unies pour la coordination des affaires humanitaires (OCHA) publié le mardi 21 janvier 2025. Ce plan permettra de « porter une assistance d’urgence aux 4,7 millions de personnes ciblées, identifiées comme étant les plus vulnérables », indique le document.  Le Mali traverse une situation sécuritaire instable depuis des années, marquée par des attaques et des conflits. La situation est particulièrement grave dans les zones de conflit au nord et au centre, où l'accès limité et les déplacements massifs menacent les plus vulnérables. Le pays connaît une augmentation des besoins humanitaires en raison de la violence continue, du changement climatique et des défis socio-économiques. Selon l’OCHA, au premier semestre 2024, la situation humanitaire dans ce pays d’Afrique de l’Ouest est restée alarmante avec des déplacements de population, des contraintes d'accès accrues et la détérioration des conditions de protection. De plus, les régions du centre et du nord ont accueilli un nombre croissant de réfugiés du Burkina Faso et de façon réduite, du Niger. Selon le HCR, en juin 2024, le Mali a accueilli plus de 120 000 réfugiés, représentant une hausse de 54% par rapport à décembre 2023. A cela s’ajoutent près de 330 713 personnes déplacées identifiées par la matrice de suivi des déplacements (DTM) en mai 2024, dont 86% de femmes et d'enfants. En mars de la même année, la situation d'insécurité alimentaire et nutritionnelle avait atteint des niveaux critiques, près de 1,3 million de personnes étant menacées par la faim durant la période de soudure. « Le Mali était le seul pays de la sous-région faisant face à des niveaux d’insécurité alimentaire catastrophiques, avec 2575 personnes en IPC 5 enregistrées dans la région de Ménaka », souligne l'OCHA. Notons qu’en 2024, l’ONU et ses partenaires ont mobilisé environ 40% des fonds nécessaires, soit un peu plus de 270 millions de dollars, permettant de fournir une assistance et une protection cruciales à 1,8 million de personnes. Lydie Mobio (Stagiaire)",https://www.agenceecofin.com/actualites/2201-125151-mali-771-millions-pour-repondre-aux-besoins-humanitaires-en-2025-onu
Abuna Yemata Guh : une église entre ciel et terre,22/01/2025," - L’Éthiopie abrite certains des sites religieux les plus impressionnants et insolites au monde. Parmi eux, Abuna Yemata Guh, une église monolithique sculptée dans une falaise vertigineuse, fascine par son accès périlleux et son cadre spectaculaire. Située dans la région du Tigré, au nord de l'Éthiopie, Abuna Yemata Guh est perchée à plus de 2 500 mètres d’altitude sur une falaise abrupte. Taillée directement dans la roche, cette église troglodytique remonte au Ve ou VIe siècle et est attribuée à Abuna Yemata, l’un des neuf saints qui ont introduit le christianisme en Éthiopie.  Pour atteindre ce sanctuaire, les pèlerins et visiteurs doivent emprunter un sentier escarpé avant d'escalader une paroi rocheuse sans aucune protection. Une traversée sur une corniche étroite, à flanc de falaise, constitue le dernier obstacle avant d’entrer dans l’église. Cette ascension vertigineuse limite naturellement le nombre de visiteurs, ajoutant au mystère et à la sacralité du lieu. Une architecture et des fresques exceptionnelles À l’intérieur, Abuna Yemata Guh dévoile de remarquables fresques bibliques datant probablement du XVe siècle.  Peintes avec des pigments naturels, ces fresques représentent des figures religieuses telles que les Apôtres, les Évangélistes et des anges, illustrant ainsi l’héritage chrétien orthodoxe éthiopien. Malgré les siècles, ces peintures ont été préservées grâce au climat sec et isolé de la région.  L’église possède également une architecture rudimentaire mais impressionnante, avec un dôme sculpté et des colonnes naturelles soutenant la structure. Son emplacement exceptionnel lui a permis d’échapper aux invasions et aux pillages, assurant ainsi la conservation de son patrimoine spirituel et artistique. Malgré la difficulté d’accès, Abuna Yemata Guh reste un lieu de culte actif. Les fidèles s’y rendent régulièrement pour prier et assister aux cérémonies religieuses. Certains parents, défiant la hauteur vertigineuse, y font même baptiser leurs enfants, une tradition qui renforce le caractère sacré du site. Un défi pour les voyageurs Ceux qui souhaitent découvrir Abuna Yemata Guh doivent être préparés à une ascension exigeante. Il est conseillé de se faire accompagner par des guides locaux expérimentés, qui assistent souvent les visiteurs dans les passages les plus dangereux. Cependant, l’effort est largement récompensé par la beauté du panorama, l’ambiance mystique et l’histoire captivante de ce lieu hors du commun.",https://www.agenceecofin.com/actualites-tourisme/2201-125150-abuna-yemata-guh-une-eglise-entre-ciel-et-terre
Le Maroc signe un protocole d’accord pour un port sec de 140 millions $ à Agadir,22/01/2025," - Annoncée depuis quelques années, la construction du port sec d’Agadir se précise. Le Maroc veut continuer la structuration d’un réseau logistique moderne et performant, capable de soutenir la croissance de ses exportations et de renforcer son attractivité pour les investisseurs internationaux. Le gouvernement marocain a franchi une nouvelle étape dans le développement de son infrastructure logistique avec la signature cette semaine d’un protocole d’accord pour la réalisation du port sec Agadir Atlantic Hub. Ce projet, dont le coût est estimé à 1,4 milliard de dirhams (140 millions dollars), vise à alléger la pression sur le port maritime d’Agadir et à fluidifier les échanges commerciaux. Selon les détails relayés par la presse locale, le protocole d’accord a été signé par des institutions clés du secteur logistique et financier marocain, dont la Caisse de dépôt et de gestion (CDG), l’Agence marocaine de développement de la logistique et l’Agence nationale des ports. Étalé sur 100 hectares, ce port sec comprendra des zones de stockage et de conditionnement adaptées aux marchandises destinées à l’exportation ou à la distribution locale. Un parc TIR sera mis en place pour faciliter le transit des camions de fret international, tandis qu’un espace dédié aux conteneurs pleins et vides optimisera la logistique portuaire. Des infrastructures administratives et douanières seront également intégrées afin d’accélérer les formalités et réduire les délais de traitement des marchandises. La mise en place de cette plateforme permettra entre autres de déconcentrer une partie des activités du port maritime de la ville pour faciliter le traitement des opérations en amont et en aval (groupage/dégroupage, dédouanement, contrôle et autorisations diverses) du fret via les navires. De quoi soulager la chaine logistique, décongestionner le port maritime, et réduire les délais ainsi que les coûts des procédures. Le projet prévoit une mise en service partielle en 2026, avant une finalisation complète en 2028. À terme, il devrait contribuer à la création de 10 000 emplois, avec un impact direct sur l’économie régionale. Toutefois, plusieurs défis restent à relever, notamment le respect du calendrier de construction, la question du raccordement aux infrastructures ferroviaires et la structuration du financement. Avec ce projet, le Maroc poursuit sa stratégie de modernisation de ses infrastructures logistiques, après le succès de Tanger Med. La réussite de ce port sec pourrait servir de modèle pour d’autres régions du pays cherchant à fluidifier leurs échanges commerciaux. Lire aussi : 10/07/2024 - Comment, en 25 ans, Mohammed VI a transformé l’économie du Maroc (2e partie)",https://www.agenceecofin.com/actualites-infrastructures/2201-125149-port-sec-d-agadir-details-techniques-et-planification-du-projet
