title,date,text,page_url
Sénégal : partenariat entre l’Etat et la CDC pour la transformation numérique,28/01/2025," - Dans le but de soutenir l’accélération de sa transformation numérique, les gouvernements multiplient les partenariats. Au Sénégal, les autorités se tournent vers une structure partageant la même vision que les objectifs étatiques. Alioune Sall, ministre sénégalais de la Communication, des Télécommunications et de l’Économie numérique, a reçu le vendredi 24 janvier Fadilou Keïta, directeur général de la Caisse de dépôt et de consignation (CDC), et Zack Diop, directeur de Synapsis, filiale de la CDC spécialisée dans les services numériques. L'objectif était d'explorer des opportunités de collaboration entre la CDC, Synapsis et les entités sous tutelle du ministère, notamment Sénégal Numérique, SN La Poste et Sénégal Connect Park. Dans le détail, les discussions des différentes parties ont porté sur la numérisation des services publics, le soutien aux projets technologiques innovants et le développement d'infrastructures connectées. Cette initiative s’inscrit dans le cadre du « New Deal Technologique » qui vise à faire du pays un leader régional dans le domaine des technologies et des innovations numériques. Le lancement officiel sera effectué par le président Bassirou Diomaye Faye en février 2025. Il faut néanmoins souligner que cette stratégie fait aussi partie de l’agenda nationale de transformation Vision 2050 du président sénégalais. Il faut toutefois souligner qu’il est essentiel de mettre en place une gouvernance claire, un partage équitable des responsabilités et une vision commune alignée sur les priorités nationales pour atteindre les objectifs préalablement visés. La mise en place d’un comité technique pourrait faciliter la collaboration entre ces différentes entités. Pour rappel, le Sénégal figure en 2024 parmi les champions africains en matière d’e-gouvernement avec un score de 0,5142 sur 1 à l’indice de développement de l’administration en ligne (EGDI), selon les Nations unies. L’Union internationale des télécommunications, de son côté, donne une note de 69,3 sur 100 au pays à l’indice d’adoption des TIC en 2024, supérieur à la moyenne africaine de 50,3. Quant à la cybersécurité, le Sénégal se positionne dans la catégorie Tier 3 avec un score de 67,17 sur 100. Adoni Conrad Quenum Edité par : Feriol Bewa Lire aussi: 20/11/2024 - Cybersécurité : un impératif pour la transition numérique du Sénégal",https://www.agenceecofin.com/actualites-numerique/2801-125300-senegal-partenariat-entre-l-etat-et-la-cdc-pour-la-transformation-numerique
BGFIBank renforce son engagement envers la conformité avec une triple certification ISO de ses filiales,28/01/2025,"( BGFIBank) - Le Groupe BGFIBank a marqué un tournant décisif dans sa démarche d’excellence en annonçant l’obtention simultanée de trois certifications ISO majeures par ses filiales BBS, BGFI Services, et Hedenia. La cérémonie de remise des certifications s’est tenue le vendredi 24 janvier, en présence de Monsieur Henri-Claude Oyima, Président Directeur Général du Groupe BGFIBank, de Madame le Ministre de l’Enseignement Supérieur, de la Recherche Scientifque et de l’Innovation Technologique, Professeur Marcelle IBINGA ITSITSA, de Monsieur Pierre Dewez, Président Directeur Général du certificateur Certi-Trust, de Monsieur Tedy Gildas M’Fouo, Directeur Commercial de Bureau Veritas Afrique Centrale, ainsi que de nombreux partenaires et invités.  Des certifications au service de l’excellence Une démarche collective pour un avenir durable Ces reconnaissances s’inscrivent pleinement dans la politique globale de qualité initié depuis plus de vingt ans au sein du Groupe BGFIBank et dont la maison mère est elle- même certifié ISO 9001:2015 depuis 2017. « Ces certifications reflètent notre détermination à nous inscrire dans une dynamique d’amélioration continue, en garantissant à nos clients, collaborateurs et partenaires des standards élevés d’excellence, de sécurité et de satisfaction », a déclaré Monsieur Henri-Claude Oyima, PDG du Groupe BGFIBank. Perspectives et impacts Ces distinctions renforcent la position du Groupe BGFIBank en tant que leader dans les secteurs sur lesquels il se positionne, en intégrant la conformité et la qualité comme des piliers essentiels de sa stratégie. Elles témoignent également de la capacité du Groupe à répondre aux enjeux contemporains, que ce soit dans le domaine éducatif, numérique ou des infrastructures. À travers ces certifications, le Groupe BGFIBank réaffirme son engagement à offrir des solutions innovantes et durables qui répondent aux besoins spécifiques de ses marchés, tout en consolidant sa réputation de partenaire de confiance. À propos du Groupe BGFIBank Le Groupe BGFIBank est un Groupe Financier International multi-métiers qui allie solidité financière, stratégie de croissance durable et maîtrise des risques, avec l’ambition d’être la banque de référence sur ses marchés en termes de qualité de service. Fidèle à ses valeurs de Travail, d'Intégrité, de Transparence, de Responsabilité et d'Esprit d'Équipe, le Groupe place la qualité de service au cœur de son métier. Il accompagne ses clients particuliers, entreprises et institutionnels dans une relation durable, avec une gamme de produits et services élargie. Le Groupe BGFIBank enrichit sans cesse son offre en s’appuyant notamment sur l’expertise de ses partenaires, s’ouvrant ainsi à de nouveaux domaines. Avec près de 2600 collaborateurs présents dans douze pays qui accompagnent au quotidien une clientèle diversifiée au Bénin, au Cameroun, en République Centrafricaine, au Congo, en Côte d'Ivoire, en France, au Gabon, en Guinée Équatoriale, à Madagascar, en République Démocratique du Congo, à Sao Tomé-et-Principe et au Sénégal. ",https://www.agenceecofin.com/actualites-finance/2801-125299-bgfibank-renforce-son-engagement-envers-la-conformite-avec-une-triple-certification-iso-de-ses-filiales
"Elon Musk, le Sud-Africain",28/01/2025," - Après ce qu’il décrit comme un salut de l’Empire romain, et que plusieurs personnes ont plutôt vu comme un salut nazi, plusieurs médias se sont interrogés sur les opinions d’Elon Musk concernant les minorités raciales. C’était l’occasion de replonger dans le passé du milliardaire qui, jusqu’à ses 17 ans, a vécu dans l’Afrique du Sud de l’apartheid, où il est né. Depuis quelques jours, Elon Musk critique sur X, son réseau social, Wikipédia et son fondateur, Jimmy Wales. Le fondateur de SpaceX reproche à Wikipédia d’évoquer un geste perçu comme un salut nazi lors de l’investiture de Donald Trump en janvier 2025. Pour saluer la foule, Elon Musk a levé la main d’une manière semblable, selon des historiens, au salut nazi. Selon d’autres, dont l’entrepreneur américain, il s’agissait d’un salut de l’Empire romain. Cela a suffi pour qu’un véritable débat naisse aux États-Unis sur les positions d’Elon Musk concernant les minorités, lui qui est né et a grandi dans l’Afrique du Sud de l’apartheid. Le garçon de Pretoria, pas comme les autres Quand on voit l’excentrique milliardaire propriétaire de SpaceX, Tesla et du réseau social X, la dernière chose qui vient à l’esprit est son origine. Pourtant, si peu de choses semblent le relier au continent africain, Elon Musk y est né le 28 juin 1971, d’un père sud-africain et d’une mère canadienne. Il y a notamment grandi durant la période de l’apartheid, un système de discrimination qui séparait les Sud-Africains blancs des noirs dans l’espace public, sur le plan réglementaire et dans l’accès aux institutions. Sous le régime de l’apartheid, les Sud-Africains étaient séparés : d’un côté la population blanche, mais aussi les métis, et de l’autre, la population noire. À travers une série de lois, les noirs étaient cantonnés à certaines parties du pays et n’avaient pas accès aux mêmes guichets de gare, aux mêmes écoles, ni même aux mêmes toilettes que les Sud-Africains blancs. Même dans les médias, de l’aveu de Sud-Africains, les populations noires recevaient certains quotidiens avec des pages manquantes. C’est dans cette ambiance que grandit Elon Musk, dont les parents divorcent alors qu’il a 10 ans. Il décide de rester avec son père, Errol, en Afrique du Sud. Une décision étonnante quand on sait que le jeune homme ne semble pas porter son père dans son cœur. « Il me traitait d’idiot tout le temps. […] Vous n’avez pas idée à quel point mon père est une mauvaise personne », confie le milliardaire, qui n’a pas la meilleure des relations avec son père. Les deux ne semblent jamais avoir pu se comprendre, et ce, depuis la plus tendre enfance du garçon. Très jeune, il ne répondait pas quand ses parents lui parlaient. Après plusieurs tests, on découvre qu’il ne souffre pas de surdité, mais plutôt du syndrome d’Asperger, une forme d’autisme. Son père semble avoir des difficultés à nouer une relation avec le jeune Elon. Selon les médecins, certains enfants Asperger sont dotés de capacités intellectuelles incroyables. En journée, Elon Musk passe son temps à regarder par la fenêtre de sa salle de classe, visiblement ennuyé par le programme scolaire. Un jour, le jeune garçon se rend à un séminaire universitaire pour l’enseignement de l’informatique. « Il devait avoir 11 ans. […] Quand je suis venu le chercher, je l’ai trouvé en train de faire un discours à tous ces adultes en costumes et grosses lunettes autour de lui. Et l’un d’eux m’a dit, ce garçon, il faut lui acheter un ordinateur. J’ai dit : Ok, ça coûte combien ? - 8000 $. Ouh... Mais je lui en ai acheté un et c’est sans doute le meilleur investissement de ma vie », confie Errol Musk. 8000 $ ; un investissement que tous les Sud-Africains ne peuvent pas se permettre. Mais Errol, ingénieur électromécanique sud-africain blanc, n’a pas trop à se plaindre de ses revenus. Mais, il l’assure, ses enfants ont été élevés avec une conscience des inégalités de l’époque. Pourtant, dans sa biographie rédigée par Walter Isaacson, Errol Musk déclare : « Sans les Blancs, les Noirs seraient retournés dans les arbres ». Privilégié, mais pas inconscient des inégalités Élu au conseil municipal de Pretoria en 1972, Errol Musk appartenait au parti progressiste anti-apartheid. Il inscrit ses enfants, y compris le jeune Elon, à Pretoria Boys, une école blanche progressiste dont le directeur aurait participé à la lutte contre l’apartheid. Stanley Netshituka, le premier étudiant noir de l'école, se montre plus nuancé sur les élèves de Pretoria Boys. « Je dirais que la majorité des étudiants étaient béatement ignorants et très heureux d'être béatement ignorants », confie-t-il. Elon Musk se lie d'amitié avec un cousin de Stanley Netshituka, Asher Mashudu. À l’enterrement de ce dernier, décédé dans un accident de voiture en 1987, Elon Musk est l’un des rares blancs présents. Il quitte finalement l’Afrique du Sud à 17 ans pour éviter de faire son service militaire et part vivre avec sa mère, Maye Haldeman. Entre-temps, avec les 8000 $ dépensés par son père, il obtient son premier ordinateur : un Commodore VIC-20. Il apprend le langage de programmation Basic et développe son premier jeu vidéo, Blastar, à seulement 12 ans. Le jeu est racheté pour 500 $ par le magazine spécialisé en informatique PC And Office Technology. Il part ensuite pour les États-Unis, où il rejoint l’université Queen’s de Kingston. Il y étudie l’économie d’entreprise, puis s’inscrit, en 1992, à l’Université de Pennsylvanie grâce à une bourse. Après deux stages au sein de la Silicon Valley, il lance avec son frère, à 24 ans, Zip2, sa première entreprise qui a pour objectif d’aider les journaux à se développer sur le web, et s’installe dans la Silicon Valley. En 1999, il vend Zip2 pour 310 millions $. Le reste de l’histoire est connu et permet à Elon Musk de devenir aujourd’hui l’homme le plus riche du monde. Un narratif sur l’Afrique du Sud remis en cause Les premières critiques sur la connaissance de l’Afrique du Sud d’Elon Musk datent de 2023 et d’une dispute du milliardaire avec Julius Malema, qui dirige les Economic Freedom Fighters, troisième force politique du pays. Elon Musk lui reproche de vouloir déclencher un génocide des blancs parce qu’il a entonné en public la chanson « Kill The Boers » (les Boers sont des colons blancs d’Afrique du Sud). Julius Malema a rétorqué qu’Elon Musk ne connaissait visiblement pas grand-chose à l’Afrique du Sud, sachant qu’il s’agissait d’une chanson historique de la période de lutte contre l’apartheid. Depuis, Elon Musk reçoit de nombreuses critiques sur sa situation à l’époque où il vivait en Afrique du Sud. En réalité, il est également pris pour cible à cause des propos de deux autres hommes, ayant, comme lui, soutenu la candidature de Donald Trump aux élections de 2024. Il s’agit de David Sacks, investisseur et soutien actif de Donald Trump, qui a quitté l’Afrique du Sud à 5 ans pour vivre aux États-Unis, et de Peter Thiel, cofondateur de PayPal, qui a passé une partie de son enfance en Namibie et en Afrique du Sud, où son père travaillait dans une mine d’uranium. Des médias rapportent que Peter Thiel a évoqué lors de ses années universitaires à Stanford l’apartheid comme un système « qui fonctionnait bien sur le plan économique ». En 1995, Peter Thiel et David Sacks ont publié un livre intitulé The Diversity Myth, qui critique le multiculturalisme et défend la civilisation occidentale. Du côté d’Elon Musk, en dehors de quelques histoires difficiles à sourcer, il n’y a pas énormément de propos sur l’Afrique du Sud. Quoi qu’il en soit, son soutien à des personnalités aux propos polémiques comme Donald Trump, qui a traité les pays africains de ""pays de merde"" (Shithole Countries ; NDLR), interpelle quand on sait qu’il a grandi en Afrique du Sud. Cela dit, le matraquage médiatique sur Elon Musk aux États-Unis n’est pas forcément neutre, sachant que de nombreux médias quittent X, nouveau nom de Twitter racheté par Elon Musk, qu’ils accusent de favoriser la désinformation sur la plateforme. Pour Elon Musk, son réseau social est devenu plus fiable que les médias traditionnels. Servan Ahougnon Edité par : Feriol Bewa",https://www.agenceecofin.com/whos-who/2801-125298-elon-musk-le-sud-africain
Bénin : le plan de refonte du système de transport de Cotonou et ses périphéries se précise,28/01/2025," - En gestation depuis quelques années, les réseaux de transport fluvio-lagunaire et par bus pour les 3 principales villes du Sud du Bénin visent à implémenter de nouvelles options de transport. Celles traditionnelles semblent moins efficaces pour contrer la congestion persistante sur les routes. Le plan de refonte du système de Transport de Cotonou a connu de nouvelles avancées avec la finalisation du Cadre politique de réinstallation (CPR). Le document dévoilé en fin de semaine dernière par la SIRAT ( Société des Infrastructures Routières et de l'Aménagement du Territoire) présente les principes organisant le plan d'action pour réinstaller et dédommager les populations impactées par le projet Ce développement constitue une avancée vers la concrétisation de ce programme dont la mise en œuvre s'étend sur la période 2022 à 2030. Le plan comprend notamment la mise en place d'un service public de bus et de lignes de transport fluvio-lagunaires entre Cotonou, Abomey-Calavi et Porto-Novo pour décongestionner les routes. Cotonou, assurant une fonction de principale ville économique et des affaires reçoit des deux autres un flux important des personnes qui convergent au quotidien vers la métropole pour motifs de travail, de commerce et autres. Pour le réseau fluvial, le Plan d'action technologique (PAT) élaboré par le ministère du cadre de vie prévoit « la mise en place d’un service avec une flotte qui se développera progressivement pour atteindre 20 bateaux-bus et assurera à terme le déplacement d’environ 7 923 000 passagers par an (3 657 000 passagers/an sur la ligne Cotonou-Porto Novo et 4 266 000 passagers /an sur la ligne Calavi-Cotonou) » indique un rapport du ministère du Cadre de vie. Le volet concernant les services de bus est à l'étape de l'aménagement de plusieurs axes routiers avant déploiement du matériel roulant. La mise en œuvre de ce projet qui s'inscrit selon les autorités dans la perspective de reconfigurer le système de transport de ces principales villes du pays permettra notamment de réduire considérablement les flux de véhicules à usage personnel ou de motos en circulation. Outre les avantages en termes de mobilité, il comprend aussi des impacts positifs en matière de durabilité. « Il devrait en résulter une amélioration de l’efficacité des consommations de carburants dans le secteur des transports et par conséquent la réduction des émissions de gaz à effet de serre (GES) pouvant avoisiner en moyenne 8074 t CO2/an en cas de comparaison avec le transport par motos et voitures particulières ». Henoc Dossa Edité par : Feriol Bewa",https://www.agenceecofin.com/actualites-infrastructures/2801-125297-benin-le-plan-de-refonte-du-systeme-de-transport-de-cotonou-et-ses-peripheries-se-precise
Crises humanitaires en Afrique : l'impact du gel de l'aide américaine,28/01/2025," - En décembre 2024, les Nations Unies et leurs partenaires humanitaires ont lancé un appel pour mobiliser 7,6 milliards $ en 2025 afin de venir en aide à 35 millions de personnes touchées par les crises en Afrique de l’Ouest et du Centre. Le décret signé par le président Donald Trump, qui suspend l'aide américaine à l'échelle mondiale, à l'exception d'Israël et de l'Egypte, suscite des inquiétudes quant à ses répercussions sur les pays africains dépendants de cette assistance humanitaire. Cette mesure, inscrite dans le cadre du programme « America First », prévoit une évaluation de l'efficacité des programmes d'aide internationale sur une période de 90 jours. Des pays tels que le Soudan du Sud, la RDC, la Somalie et l’Ethiopie, déjà touchés par des crises humanitaires notamment la famine et les déplacements causés par les conflits, le changement climatique et l’instabilité économique, pourraient se voir privés d’un soutien essentiel. Impact sur les pays en crise Le Soudan du Sud, en proie à des conflits prolongés, à des déplacements massifs et à la famine aggravée par le changement climatique, illustre la gravité de la situation. En 2024, environ 9 millions de personnes, soit 73% de la population, avaient besoin d’une aide humanitaire, dont 7 millions confrontées à une insécurité alimentaire aiguë durant la période de soudure. Les contributions des Etats-Unis ont atteint 351 millions $ au mois de juillet 2024, portant le total depuis 2011 à près de 7,3 milliards $. Par ailleurs, le Plan de réponse humanitaire 2025 prévoit un financement de 4,2 milliards $ pour soutenir près de 21 millions de personnes vulnérables, rétablir les services de base et renforcer la protection, selon l’OCHA. En RDC, plus de 25 millions de personnes font face à une insécurité alimentaire critique, accentuée par des conflits armés, des catastrophes naturelles et des épidémies. Avec 5,7 millions de déplacés internes, le pays est au cœur d’une crise humanitaire. En 2024, l’USAID a débloqué 424 millions $ d’aide humanitaire et envoyé des vaccins pour lutter contre des épidémies telles que la mpox. Sur la dernière décennie, l’aide américaine à la RDC a dépassé 6 milliards $. Selon Humanitarian Action, en 2025, environ 21,2 millions de personnes en RDC nécessiteront une assistance humanitaire, avec des besoins financiers estimés à 2,5 milliards $, ciblant 11 millions de bénéficiaires prioritaires. La Somalie, quant à elle, frappée par l’insécurité, la pauvreté chronique et des événements climatiques extrêmes, comptait en 2024 environ 6,9 millions de personnes en besoin d’assistance humanitaire. Entre octobre et décembre, les USA ont engagé 97,5 millions $ dans des programmes de résilience, de sécurité alimentaire et de réformes structurelles. Depuis 2022, près de 2,3 milliards $ ont été versés à la Somalie pour répondre aux besoins urgents. Le Plan d’action et de réponse humanitaire 2025 prévoit d’aider 5,98 millions de personnes, avec un budget estimé à 1,4 milliard $, soit une baisse de 10% par rapport à 2024, selon l’OCHA. Dans la même dynamique, l'Ethiopie, où l'assistance internationale avait été suspendue en 2023 en raison de détournements présumés, a vu un renouvellement du soutien de la communauté internationale. En 2024, les Etats-Unis ont déboursé 1,2 milliard $, tandis que les besoins humanitaires étaient estimés à 2,9 milliards $, selon l’OCHA. Pour 2025, ces besoins sont projetés à 2 milliards $. L’Afrique face à l’insécurité alimentaire L’Afrique subsaharienne reste l’épicentre de l’insécurité alimentaire mondiale. Selon l’Organisation des Nations Unies pour l’alimentation et l’agriculture (FAO), 342 millions de personnes sur le continent souffraient d’insécurité alimentaire grave en 2022. En réponse, le pays de l’Oncle Sam a mobilisé 6,6 milliards $ d’aide en 2024, poursuivant son engagement historique. Lors de sa visite en Angola en décembre 2024, l’ancien président Joe Biden avait d’ailleurs annoncé un milliard $ supplémentaires pour lutter contre la faim et répondre aux besoins urgents dans 31 pays africains. Outre le gel de ses aides étrangères, l’administration Trump a décidé de retirer son soutien financier à l’Organisation mondiale de la santé (OMS). Une décision jugée « regrettable » par l’organisation. Il faut noter que pour 2025, les Nations Unies et leurs partenaires humanitaires ont lancé un appel pour mobiliser 7,6 milliards $. Il vise à fournir une aide vitale à 35 millions de personnes affectées par les multiples crises en Afrique de l’Ouest et du Centre, notamment les conflits, l’insécurité alimentaire et les catastrophes climatiques. Charlène N’dimon Lire aussi : 08/07/2024 - Soudan du Sud : une assistance de 57 millions $ annoncée par les USA 09/08/2024 - RDC : 424 millions $ d’aide des USA en réponse à la crise humanitaire 11/09/2024 - RDC : un lot de 50 000 vaccins contre la mpox en provenance des USA 04/12/2024 - Crise humanitaire : les USA annoncent une aide de 1 milliard $ en Afrique",https://www.agenceecofin.com/actualites/2801-125296-crises-humanitaires-en-afrique-limpact-du-gel-de-laide-americaine
Burkina Faso : un nouveau dépôt de carburant pour assurer la sécurité énergétique,28/01/2025," - Le Burkina Faso, grand importateur de produits pétroliers, se fait livrer notamment des volumes de gasoil et d’essence en provenance de son voisin, le Niger, également fournisseur du Mali. Le dimanche 26 janvier, Jean Emmanuel Ouédraogo, le Premier ministre du Burkina Faso, a inauguré une unité de stockage de carburant d’une capacité de 104 000 m³ à Péni, dans la région des Hauts-Bassins, à l’ouest du pays. Financée à hauteur de 32 milliards FCFA (environ 51 millions de dollars) et construite sur une superficie de 100 hectares, cette installation devrait permettre au Burkina Faso de renforcer ses approvisionnements en super, en gasoil et en diesel duty oil (DDO). « Cette installation marque non seulement une avancée décisive vers la modernisation de notre secteur énergétique, mais aussi l’affirmation de la souveraineté énergétique du Burkina Faso », a déclaré Wendpanga Aimé Nongkouni, le directeur général de la Société Nationale Burkinabè d’Hydrocarbures (SONABHY), lors de la cérémonie d’inauguration. Jusqu’à présent, le Burkina Faso disposait de trois unités de stockage de carburant à Bobo-Dioulasso, Bingo et Péni. Face à la croissance de la demande nationale, le pays a lancé plusieurs projets d’extension de ces unités de stockage. Des projets d’unités de stockage d’hydrocarbures sont prévus également à Kaya, Ouaga Est, Pô, Koupéla et Bingo. Ces initiatives devraient aider le Burkina Faso à mieux affronter les défis de pénurie de carburant souvent posés par le déficit d’unités de stockage. Ces projets s’inscrivent dans le cadre du plan stratégique de la SONABHY pour la période 2023-2027, visant à renforcer les capacités en produits pétroliers liquides et à répondre aux besoins énergétiques futurs du Burkina Faso. Selon les données de Trade Economics, les produits pétroliers ont été la principale importation du Burkina Faso en 2022, avec un coût total de 1,19 milliard de dollars pour l’État. Par ailleurs, des chiffres publiés par Statista en janvier 2024 indiquent que les importations de combustibles fossiles ont atteint 1,36 milliard de dollars en 2021. Abdel-Latif Boureima Édité par Wilfried ASSOGBA Lire aussi : 19/02/2024 - Hydrocarbures : le Niger va fournir du gasoil à ses voisins du Tchad, du Mali et du Burkina Faso",https://www.agenceecofin.com/actualites-infrastructures/2801-125295-burkina-faso-un-nouveau-depot-de-carburant-pour-assurer-la-securite-energetique
